Name,Description,Latitude ,Longitude ,InfoURL,ImageURL
Carmel River State Beach,A beautiful beach and laggoon located at the end of the Carmel River,36.532222,-121.926944,https://en.wikipedia.org/wiki/Carmel_River_State_Beach,https://www.flickr.com/photos/dschultz742/6479922369
Point Lobos S,A state park with protected land and marine wildlife,36.5171,-121.9426,https://en.wikipedia.org/wiki/Point_Lobos,https://www.californiabeaches.com/beach/point-lobos-snr-china-cove/
Carmel Beach,"A busy, but also dog friendly, beach in Carmel located at the end of Ocean Avenue",36.555278,-121.923333,"https://en.wikipedia.org/wiki/Carmel-by-the-Sea,_California",http://svfacademy.com/en/american-study-tour/2320.html
"Garrapata State Park
",A state park with coastal hiking trails and incredible wildlife,36.466667,-121.9,https://en.wikipedia.org/wiki/Garrapata_State_Park,https://50campfires.com/camping-garrapata-state-park-california/
Lover's Point,A protected beach and marine area located in downtown Pacific Grove,36.6262,-121.9164,https://en.wikipedia.org/wiki/Lovers_Point_State_Marine_Reserve,https://www.google.com/search?q=lover%27s+point+PG&rlz=1C1GGRV_enUS757US757&source=lnms&tbm=isch&sa=X&ved=0ahUKEwiNsdCt1b7iAhXOv54KHWk2Ck4Q_AUIDygC&biw=1680&bih=907#imgrc=xSHAiHs3YpgdBM:
Monterey bay Aquarium,One of the world's greatest non-profit public aquariums,36.6181,-121.9019,https://en.wikipedia.org/wiki/Monterey_Bay_Aquarium,https://www.google.com/search?q=monterey+bay+aquarium&rlz=1C1GGRV_enUS757US757&source=lnms&tbm=isch&sa=X&ved=0ahUKEwivj57c1b7iAhWHvJ4KHYDLDXIQ_AUIDygC&biw=1680&bih=907#imgrc=JuSaVcmoIf1V5M:
UCSB,A great University located along the California Coast,34.416929,-119.845991,"https://en.wikipedia.org/wiki/University_of_California,_Santa_Barbara",https://www.google.com/search?q=UCSB&rlz=1C1GGRV_enUS757US757&source=lnms&tbm=isch&sa=X&ved=0ahUKEwjegrGj1r7iAhUHsJ4KHU0SB7kQ_AUIDygC&biw=1680&bih=907#imgrc=JvhtM0DLKsQgxM: